{
  "id": "ankle-flexion-study",
  "tradition": "feldenkrais",
  "title": "Ankle flexion and extension study",
  "summary": "One ankle alternates between lifting the forefoot and pointing it, with the shin held steady.",
  "asset_manifest": "../phase-0/assets/original/reference-rig.json",
  "phases": [
    {
      "id": "explore",
      "t": [
        0,
        7
      ],
      "joint_actions": [
        {
          "joint": "tibia-left",
          "action": "dorsiflexion"
        }
      ],
      "muscles": [
        {
          "id": "gastrocnemius-left",
          "behaviour": "lengthens"
        }
      ]
    },
    {
      "id": "develop",
      "t": [
        7,
        14
      ],
      "joint_actions": [
        {
          "joint": "tibia-left",
          "action": "plantar flexion"
        }
      ],
      "muscles": [
        {
          "id": "gastrocnemius-left",
          "behaviour": "shortens"
        }
      ]
    },
    {
      "id": "return",
      "t": [
        14,
        20
      ],
      "joint_actions": [
        {
          "joint": "tibia-left",
          "action": "return to the starting arrangement"
        }
      ],
      "muscles": [
        {
          "id": "gastrocnemius-left",
          "behaviour": "lengthens"
        }
      ]
    }
  ],
  "instruction": {
    "exploration": "Observe the angle between the shin and the foot rather than copying its range.",
    "attention": [
      {
        "phase": "explore",
        "cue": "The display emphasizes tibia left."
      },
      {
        "phase": "develop",
        "cue": "The display emphasizes tibia left."
      },
      {
        "phase": "return",
        "cue": "The display emphasizes tibia left."
      }
    ],
    "range": {
      "kind": "optional",
      "smaller_reference": "The same relationship can be displayed with smaller angles and pauses between changes."
    },
    "rest_pauses": [
      {
        "after_phase": "return",
        "duration_seconds": 8,
        "note": "The animation ends at neutral so the anatomical relationship can be compared."
      }
    ]
  },
  "variations": [
    {
      "id": "reduced-amplitude",
      "kind": "range",
      "note": "A lower-amplitude rendering preserves the same joint relationships."
    }
  ],
  "safety": {
    "cautions": [
      "This animation visualizes an authored movement theme and is not an Awareness Through Movement lesson."
    ],
    "expects_teacher": false,
    "notes": "The display does not replace verbal guidance, individual variation, or practitioner observation."
  },
  "source": {
    "tradition_basis": "Project-authored anatomical study using movement themes published by the Feldenkrais Guild; no lesson text, recording, or teacher sequence is copied.",
    "rights_basis": "provisional: project-authored record and animation using a procedural fitted-reference body; no third-party movement media or anatomy asset is packaged",
    "authored_by": "Siteprep project",
    "authored_on": "2026-09-06",
    "claim_sources": [
      {
        "title": "Pleasant Exploration of Hands and Feet",
        "url": "https://feldenkrais.com/pleasant-exploration-of-hands-and-feet/",
        "supports": [
          "small clock movements",
          "sliding a hand along a surface",
          "initiating from different places"
        ]
      }
    ],
    "review": {
      "status": "unreviewed",
      "notes": "Requires review by a Feldenkrais practitioner and an anatomy reviewer. Muscle behaviours are illustrative anatomical hypotheses, not measurements of contraction or activity."
    }
  }
}
