{
  "id": "dynamic-chair-clock-study",
  "tradition": "feldenkrais",
  "title": "Dynamic sitting and chair-clock study",
  "summary": "A seated reference traces small pelvic shifts and shows their propagation through lumbar and thoracic segments.",
  "asset_manifest": "../phase-0/assets/original/reference-rig.json",
  "phases": [
    {
      "id": "side-shift",
      "t": [
        0,
        10
      ],
      "joint_actions": [
        {
          "joint": "pelvis",
          "action": "small lateral tilt"
        },
        {
          "joint": "lumbar-spine",
          "action": "following lateral flexion"
        }
      ],
      "muscles": [
        {
          "id": "external-oblique-left",
          "behaviour": "shortens"
        },
        {
          "id": "external-oblique-right",
          "behaviour": "lengthens"
        }
      ]
    },
    {
      "id": "return-across",
      "t": [
        10,
        22
      ],
      "joint_actions": [
        {
          "joint": "pelvis",
          "action": "small opposite tilt"
        },
        {
          "joint": "thoracic-lower",
          "action": "counterbalancing motion"
        }
      ],
      "muscles": [
        {
          "id": "multifidus-left",
          "behaviour": "stabilises"
        },
        {
          "id": "multifidus-right",
          "behaviour": "stabilises"
        }
      ]
    }
  ],
  "instruction": {
    "exploration": "An anatomical rendering of a chair-clock theme, emphasizing the relationship between pelvic shift and spinal response.",
    "attention": [
      {
        "phase": "side-shift",
        "cue": "The display emphasizes pelvis and lumbar spine."
      },
      {
        "phase": "return-across",
        "cue": "The display emphasizes pelvis and thoracic lower."
      }
    ],
    "range": {
      "kind": "optional",
      "smaller_reference": "A smaller rendered shift would keep the same pelvis-to-spine relationship."
    },
    "rest_pauses": [
      {
        "after_phase": "return-across",
        "duration_seconds": 8,
        "note": "The animation ends at neutral so the anatomical relationship can be compared."
      }
    ]
  },
  "variations": [
    {
      "id": "reduced-amplitude",
      "kind": "range",
      "note": "A lower-amplitude rendering preserves the same joint relationships."
    }
  ],
  "safety": {
    "cautions": [
      "This animation visualizes an authored movement theme and is not an Awareness Through Movement lesson."
    ],
    "expects_teacher": false,
    "notes": "The display does not replace verbal guidance, individual variation, or practitioner observation."
  },
  "source": {
    "tradition_basis": "Project-authored anatomical study using movement themes published by the Feldenkrais Guild; no lesson text, recording, or teacher sequence is copied.",
    "rights_basis": "provisional: project-authored record and animation using a procedural fitted-reference body; no third-party movement media or anatomy asset is packaged",
    "authored_by": "Siteprep project",
    "authored_on": "2026-08-22",
    "claim_sources": [
      {
        "title": "Feldenkrais Guild sample lessons",
        "url": "https://feldenkrais.com/enjoy-a-free-sample-lesson/",
        "supports": [
          "dynamic sitting and chair clock",
          "pelvic and spinal exploration",
          "shoulder exploration"
        ]
      },
      {
        "title": "Pleasant Exploration of Hands and Feet",
        "url": "https://feldenkrais.com/pleasant-exploration-of-hands-and-feet/",
        "supports": [
          "small clock movements",
          "sliding a hand along a surface",
          "initiating from different places"
        ]
      },
      {
        "title": "Skeletal anatomy as a basis for attention within the whole",
        "url": "https://feldenkrais.com/skeletal-anatomy-as-a-basis-for-constellating-attention-within-the-whole/",
        "supports": [
          "whole-body skeletal relationships",
          "shoulder and pelvic girdle relationship",
          "anatomical observation"
        ]
      }
    ],
    "review": {
      "status": "unreviewed",
      "notes": "Requires review by a Feldenkrais practitioner and an anatomy reviewer."
    }
  }
}
