{
  "id": "standing-forward-fold-study",
  "tradition": "yoga",
  "title": "Uttanasana anatomy",
  "summary": "A sagittal study displays hip flexion, spinal segmentation, and posterior-leg muscle paths during a forward fold.",
  "asset_manifest": "../phase-0/assets/original/reference-rig.json",
  "phases": [
    {
      "id": "hinge",
      "t": [
        0,
        8
      ],
      "joint_actions": [
        {
          "joint": "hip-left",
          "action": "flexion"
        },
        {
          "joint": "hip-right",
          "action": "flexion"
        }
      ],
      "muscles": [
        {
          "id": "hamstrings-left",
          "behaviour": "lengthens"
        },
        {
          "id": "hamstrings-right",
          "behaviour": "lengthens"
        }
      ]
    },
    {
      "id": "display",
      "t": [
        8,
        15
      ],
      "joint_actions": [
        {
          "joint": "lumbar-spine",
          "action": "flexion"
        },
        {
          "joint": "thoracic-lower",
          "action": "flexion"
        }
      ],
      "muscles": [
        {
          "id": "erector-spinae-left",
          "behaviour": "lengthens"
        },
        {
          "id": "erector-spinae-right",
          "behaviour": "lengthens"
        }
      ]
    },
    {
      "id": "return",
      "t": [
        15,
        22
      ],
      "joint_actions": [
        {
          "joint": "hip-left",
          "action": "extension toward neutral"
        },
        {
          "joint": "lumbar-spine",
          "action": "return toward neutral"
        }
      ],
      "muscles": [
        {
          "id": "gluteus-maximus-left",
          "behaviour": "shortens"
        },
        {
          "id": "gluteus-maximus-right",
          "behaviour": "shortens"
        }
      ]
    }
  ],
  "instruction": {
    "posture": "The reference hinges forward at the hips with an authored degree of spinal flexion and relaxed arm position.",
    "transitions": [
      {
        "phase": "hinge",
        "direction": "entry",
        "cue": "The reference animation moves from neutral into the displayed joint arrangement."
      },
      {
        "phase": "return",
        "direction": "exit",
        "cue": "The final frames return the fitted reference toward neutral."
      }
    ],
    "modifications": [
      {
        "id": "supported-reference",
        "note": "A chair-supported reference would stop the trunk at a higher angle."
      }
    ],
    "props": [
      "chair",
      "blocks"
    ]
  },
  "variations": [
    {
      "id": "smaller-display-range",
      "kind": "range",
      "note": "The authored clip may be viewed over a smaller angular range."
    }
  ],
  "safety": {
    "cautions": [
      "This is an anatomical display, not a recommendation to attempt the posture or match its range."
    ],
    "expects_teacher": false,
    "notes": "Suitability, balance, loading, and individual restrictions are outside this visualization."
  },
  "source": {
    "tradition_basis": "Project-authored anatomical study using posture names listed by Iyengar Yoga organizations; no teacher sequence or instructional wording is copied.",
    "rights_basis": "provisional: project-authored record and animation using a procedural fitted-reference body; no third-party movement media or anatomy asset is packaged",
    "authored_by": "Siteprep project",
    "authored_on": "2026-08-22",
    "claim_sources": [
      {
        "title": "Iyengar Yoga Level I curriculum",
        "url": "https://iyengar.hu/wp-content/uploads/2017/11/Curriculum-Level-I.pdf",
        "supports": [
          "named standing postures",
          "posture families",
          "supported variants"
        ]
      },
      {
        "title": "Geeta S. Iyengar practice sequence",
        "url": "https://iyengaryoga.org.uk/wp-content/uploads/2023/06/International-Day-of-Yoga-Sequence-IYUK.pdf",
        "supports": [
          "Tadasana",
          "Uttanasana",
          "Utthita Trikonasana",
          "Virabhadrasana",
          "use of props"
        ]
      }
    ],
    "review": {
      "status": "unreviewed",
      "notes": "Requires review by a yoga practitioner and an anatomy reviewer."
    }
  }
}
